{
  "$schema": "https://json-schema.org/draft/2020-12/schema",
  "$id": "https://github.com/augentic/specify-cli/schemas/lint/workspace-model.schema.json",
  "title": "Specify WorkspaceModel (v1)",
  "description": "Deterministic, versioned snapshot of project facts produced by `specrun lint` for the `WorkspaceModel` schema. Persistence and query reserve: `.specify/cache/workspace-model.v1.json` is reserved as the future v2 persistence location; `specrun model query <selector>` is reserved as a future read-only CLI verb. v1 ships `--dump-model` only.",
  "type": "object",
  "additionalProperties": false,
  "required": [
    "version",
    "project_dir",
    "scan_profile",
    "artifact_paths",
    "languages",
    "files",
    "frontmatter",
    "markdown_sections",
    "markdown_links",
    "symlinks",
    "skills",
    "adapter_manifests",
    "marketplace_entries",
    "rule_index",
    "text_matches"
  ],
  "properties": {
    "version": {
      "const": 1,
      "description": "`WorkspaceModel`: version discriminant. Breaking indexer output bumps the version; v1 pins the shape defined by this schema."
    },
    "project_dir": {
      "type": "string",
      "minLength": 1,
      "description": "`WorkspaceModel` extraction inputs: scan root (consumer project or framework repo). Typically the project root absolute path; relative `.` is accepted for tests and ephemeral scans."
    },
    "scan_profile": {
      "type": "string",
      "enum": ["consumer", "framework"],
      "description": "`WorkspaceModel` extraction inputs: controls which extractors run. `consumer` is the only Phase 2 profile; `framework` is reserved for a future framework scan."
    },
    "artifact_paths": {
      "type": "array",
      "items": { "$ref": "#/$defs/relativePath" },
      "description": "`WorkspaceModel` extraction inputs: optional narrow list. Empty array means the indexer performs a full profile-specific scan by the file scan contract."
    },
    "languages": {
      "type": "array",
      "items": {
        "type": "string",
        "minLength": 1
      },
      "description": "`WorkspaceModel` extraction inputs: optional language tokens supplied by caller or inferred from paths."
    },
    "files": {
      "type": "array",
      "items": { "$ref": "#/$defs/file" },
      "description": "`WorkspaceModel` entity: `file` facts produced by the filesystem walk."
    },
    "frontmatter": {
      "type": "array",
      "items": { "$ref": "#/$defs/frontmatter" },
      "description": "`WorkspaceModel` entity: `frontmatter` facts from markdown `---` block extraction plus YAML parse."
    },
    "markdown_sections": {
      "type": "array",
      "items": { "$ref": "#/$defs/markdownSection" },
      "description": "`WorkspaceModel` entity: `markdown_section` facts from the markdown structure pass."
    },
    "markdown_links": {
      "type": "array",
      "items": { "$ref": "#/$defs/markdownLink" },
      "description": "`WorkspaceModel` entity: `markdown_link` facts from the fence-aware link scan."
    },
    "symlinks": {
      "type": "array",
      "items": { "$ref": "#/$defs/symlink" },
      "description": "`WorkspaceModel` entity: `symlink` facts; recorded but not traversed by the file scan contract."
    },
    "skills": {
      "type": "array",
      "items": { "$ref": "#/$defs/skill" },
      "description": "`WorkspaceModel` entity: `skill` facts from `plugins/**/SKILL.md`."
    },
    "adapter_manifests": {
      "type": "array",
      "items": { "$ref": "#/$defs/adapterManifest" },
      "description": "`WorkspaceModel` entity: `adapter_manifest` facts from `adapters/{sources,targets}/**/adapter.yaml`."
    },
    "marketplace_entries": {
      "type": "array",
      "items": { "$ref": "#/$defs/marketplaceEntry" },
      "description": "`WorkspaceModel` entity: `marketplace_entry` facts from `.cursor-plugin/marketplace.json`."
    },
    "rule_index": {
      "type": "array",
      "items": { "$ref": "#/$defs/ruleIndexEntry" },
      "description": "`WorkspaceModel` entity: `rule_index` facts from rules tree discovery (reuses the rule frontmatter parser)."
    },
    "text_matches": {
      "type": "array",
      "items": { "$ref": "#/$defs/textMatch" },
      "description": "`WorkspaceModel` entity: `text_match` facts from the optional precomputed regex index."
    },
    "ignore_directives": {
      "type": "array",
      "items": { "$ref": "#/$defs/ignoreDirective" },
      "description": "`WorkspaceModel` entity: `ignore_directive` facts from the RFC-33a indexer pass that recognises `specify-ignore: <RULE-ID> â€” <rationale>` comments across the closed comment-style list. Optional in v1 envelopes until the indexer extractor lands; consumers MUST tolerate the field's absence."
    }
  },
  "$defs": {
    "relativePath": {
      "type": "string",
      "minLength": 1,
      "description": "`WorkspaceModel` stability: paths are project-relative with forward slashes."
    },
    "sha256Hex": {
      "type": "string",
      "pattern": "^[0-9a-f]{64}$",
      "description": "Hex-encoded SHA-256 digest (64 lowercase hex characters)."
    },
    "file": {
      "type": "object",
      "additionalProperties": false,
      "required": ["path", "kind"],
      "properties": {
        "path": { "$ref": "#/$defs/relativePath" },
        "kind": {
          "type": "string",
          "enum": ["text", "binary"],
          "description": "`WorkspaceModel` file scan: `binary` when the first 8 KiB contains a NUL byte; otherwise `text`."
        },
        "language": {
          "type": "string",
          "minLength": 1,
          "description": "Optional language token inferred from extension or supplied by the caller."
        },
        "sha256": {
          "$ref": "#/$defs/sha256Hex",
          "description": "Optional content digest; populated when extractors need cross-file identity (e.g. `agent_teams` canonical SHA check)."
        }
      }
    },
    "frontmatter": {
      "type": "object",
      "additionalProperties": false,
      "required": ["path", "fields"],
      "properties": {
        "path": { "$ref": "#/$defs/relativePath" },
        "schema-id": {
          "type": "string",
          "minLength": 1,
          "description": "`WorkspaceModel` entity: optional schema id the frontmatter declares (matches the registered-schema token shape from the registered-schema token shape)."
        },
        "fields": {
          "type": "object",
          "description": "`WorkspaceModel` entity: parsed YAML field map. Per-key shape is rule-specific; the model holds the raw value tree.",
          "additionalProperties": true
        }
      }
    },
    "markdownSection": {
      "type": "object",
      "additionalProperties": false,
      "required": ["path", "level", "title", "line-start", "line-end", "body-line-count"],
      "properties": {
        "path": { "$ref": "#/$defs/relativePath" },
        "level": {
          "type": "integer",
          "minimum": 1,
          "maximum": 6,
          "description": "`WorkspaceModel` entity: markdown heading level (1â€“6)."
        },
        "title": {
          "type": "string",
          "minLength": 1,
          "description": "Heading text after the leading `#`s, with surrounding whitespace trimmed."
        },
        "line-start": {
          "type": "integer",
          "minimum": 1,
          "description": "1-based line of the heading line itself."
        },
        "line-end": {
          "type": "integer",
          "minimum": 1,
          "description": "1-based last line that belongs to this section (the line before the next same-or-higher-level heading, or the file's last line)."
        },
        "body-line-count": {
          "type": "integer",
          "minimum": 0,
          "description": "`WorkspaceModel` entity: number of non-heading body lines under the section."
        }
      }
    },
    "markdownLink": {
      "type": "object",
      "additionalProperties": false,
      "required": ["from-path", "to-raw", "line"],
      "properties": {
        "from-path": {
          "$ref": "#/$defs/relativePath",
          "description": "`WorkspaceModel` entity: path of the markdown file containing the link."
        },
        "to-raw": {
          "type": "string",
          "minLength": 1,
          "description": "`WorkspaceModel` entity: verbatim link target as authored (relative path, URL, or anchor)."
        },
        "line": {
          "type": "integer",
          "minimum": 1,
          "description": "1-based line of the link occurrence."
        },
        "resolves": {
          "type": "boolean",
          "description": "`WorkspaceModel` entity: optional; `true` when the target resolves on disk, `false` for broken/dangling references. Absent for off-tree URLs the indexer did not attempt to resolve."
        }
      }
    },
    "symlink": {
      "type": "object",
      "additionalProperties": false,
      "required": ["path", "target", "broken"],
      "properties": {
        "path": { "$ref": "#/$defs/relativePath" },
        "target": {
          "type": "string",
          "minLength": 1,
          "description": "`WorkspaceModel` entity: symlink target as recorded by the filesystem (may be relative or absolute)."
        },
        "broken": {
          "type": "boolean",
          "description": "`WorkspaceModel` entity: `true` when the link target does not exist on disk."
        }
      }
    },
    "skill": {
      "type": "object",
      "additionalProperties": false,
      "required": ["name", "path", "plugin", "frontmatter-ref"],
      "properties": {
        "name": {
          "type": "string",
          "minLength": 1,
          "description": "`WorkspaceModel` entity: skill name (matches the `name:` frontmatter field)."
        },
        "path": { "$ref": "#/$defs/relativePath" },
        "plugin": {
          "type": "string",
          "minLength": 1,
          "description": "`WorkspaceModel` entity: owning plugin slug (the directory under `plugins/`)."
        },
        "frontmatter-ref": {
          "$ref": "#/$defs/relativePath",
          "description": "`WorkspaceModel` entity: path back to the originating `frontmatter` fact so consumers can join through the frontmatter table."
        }
      }
    },
    "adapterManifest": {
      "type": "object",
      "additionalProperties": false,
      "required": ["axis", "name", "path"],
      "properties": {
        "axis": {
          "type": "string",
          "enum": ["sources", "targets"],
          "description": "`WorkspaceModel` entity: `sources` xor `targets` (the on-disk parent directory under `adapters/`)."
        },
        "name": {
          "type": "string",
          "minLength": 1,
          "description": "Adapter name from `adapter.yaml`."
        },
        "path": { "$ref": "#/$defs/relativePath" },
        "version": {
          "type": "string",
          "minLength": 1,
          "description": "Optional manifest version; absent when the adapter does not pin one."
        }
      }
    },
    "marketplaceEntry": {
      "type": "object",
      "additionalProperties": false,
      "required": ["plugin", "path-in-manifest"],
      "properties": {
        "plugin": {
          "type": "string",
          "minLength": 1,
          "description": "`WorkspaceModel` entity: plugin slug declared by `.cursor-plugin/marketplace.json`."
        },
        "path-in-manifest": {
          "type": "string",
          "minLength": 1,
          "description": "`WorkspaceModel` entity: JSON-pointer-style location inside `marketplace.json` where the entry was discovered."
        }
      }
    },
    "ruleIndexEntry": {
      "type": "object",
      "additionalProperties": false,
      "required": ["rule-id", "path", "origin", "frontmatter-ref"],
      "properties": {
        "rule-id": {
          "type": "string",
          "minLength": 1,
          "description": "`WorkspaceModel` entity: rule id (matches the rule schema's `id` regex)."
        },
        "path": { "$ref": "#/$defs/relativePath" },
        "origin": {
          "type": "string",
          "enum": ["target", "source", "shared", "core", "unknown"],
          "description": "`WorkspaceModel` entity: which rules tree contributed the rule (target adapter, source adapter, shared universal tree, core rules pack, or `unknown` for cache files whose path does not match a recognized adapter shape)."
        },
        "frontmatter-ref": {
          "$ref": "#/$defs/relativePath",
          "description": "`WorkspaceModel` entity: path back to the originating `frontmatter` fact so consumers can join through the frontmatter table."
        }
      }
    },
    "textMatch": {
      "type": "object",
      "additionalProperties": false,
      "required": ["path", "line", "column", "pattern-id"],
      "properties": {
        "path": { "$ref": "#/$defs/relativePath" },
        "line": {
          "type": "integer",
          "minimum": 1,
          "description": "1-based line of the match."
        },
        "column": {
          "type": "integer",
          "minimum": 1,
          "description": "1-based column of the match."
        },
        "pattern-id": {
          "type": "string",
          "minLength": 1,
          "description": "`WorkspaceModel` entity: stable identifier for the precomputed regex pattern that produced this match."
        }
      }
    },
    "ignoreDirective": {
      "type": "object",
      "additionalProperties": false,
      "required": ["path", "line", "rule-id", "target-line", "raw"],
      "properties": {
        "path": {
          "$ref": "#/$defs/relativePath",
          "description": "`WorkspaceModel` entity: project-relative path of the file containing the directive comment."
        },
        "line": {
          "type": "integer",
          "minimum": 1,
          "description": "1-based line of the directive comment itself."
        },
        "rule-id": {
          "type": "string",
          "minLength": 1,
          "description": "`WorkspaceModel` entity: rule id named by the directive (matches the rule schema's `id` regex; not pattern-pinned here so malformed directives can still surface as `UNI-022` / `UNI-023` candidates)."
        },
        "rationale": {
          "type": "string",
          "minLength": 1,
          "description": "Verbatim rationale text from the directive comment. Absent when the directive was malformed (missing or empty rationale); the directive-validation pass emits `UNI-022` in that case."
        },
        "target-line": {
          "type": "integer",
          "minimum": 1,
          "description": "1-based line the directive applies to. Inline trailing directives target their own line; block-leading directives target the next non-blank, non-comment line."
        },
        "raw": {
          "type": "string",
          "minLength": 1,
          "description": "Raw directive comment text as captured by the indexer, including delimiters; used by formatters that surface the original source spelling."
        }
      }
    }
  }
}
