{
  "adapter_manifests": [],
  "artifact_paths": [],
  "files": [
    {
      "kind": "text",
      "language": "json",
      "path": ".specify/.!47447!nonutf8.json"
    },
    {
      "kind": "text",
      "language": "json",
      "path": ".specify/.!47532!nonutf8.json"
    },
    {
      "kind": "text",
      "language": "json",
      "path": ".specify/.!50591!nonutf8.json"
    },
    {
      "kind": "binary",
      "path": ".specify/blob.bin"
    },
    {
      "kind": "text",
      "language": "markdown",
      "path": ".specify/cache/rules/adapters/shared/rules/universal/UNI-099.md"
    },
    {
      "kind": "text",
      "language": "json",
      "path": ".specify/nonutf8.json"
    },
    {
      "kind": "text",
      "language": "markdown",
      "path": "README.md"
    },
    {
      "kind": "text",
      "language": "markdown",
      "path": "doc.md"
    }
  ],
  "frontmatter": [
    {
      "fields": {
        "authors": [
          "alice",
          "bob"
        ],
        "schema_id": "demo",
        "title": "Minimal Demo"
      },
      "path": "doc.md"
    }
  ],
  "languages": [],
  "markdown_links": [
    {
      "from-path": "doc.md",
      "line": 14,
      "resolves": true,
      "to-raw": "./README.md"
    },
    {
      "from-path": "doc.md",
      "line": 14,
      "to-raw": "https://example.com"
    }
  ],
  "markdown_sections": [
    {
      "body-line-count": 5,
      "level": 2,
      "line-end": 12,
      "line-start": 7,
      "path": ".specify/cache/rules/adapters/shared/rules/universal/UNI-099.md",
      "title": "Rule"
    },
    {
      "body-line-count": 31,
      "level": 1,
      "line-end": 32,
      "line-start": 1,
      "path": "README.md",
      "title": "`lint/minimal` fixture"
    },
    {
      "body-line-count": 23,
      "level": 1,
      "line-end": 31,
      "line-start": 8,
      "path": "doc.md",
      "title": "Top Heading"
    },
    {
      "body-line-count": 15,
      "level": 2,
      "line-end": 27,
      "line-start": 12,
      "path": "doc.md",
      "title": "Subsection"
    },
    {
      "body-line-count": 3,
      "level": 2,
      "line-end": 31,
      "line-start": 28,
      "path": "doc.md",
      "title": "Sibling"
    }
  ],
  "marketplace_entries": [],
  "project_dir": "<TEMPDIR>",
  "rule_index": [
    {
      "frontmatter-ref": ".specify/cache/rules/adapters/shared/rules/universal/UNI-099.md#frontmatter",
      "origin": "shared",
      "path": ".specify/cache/rules/adapters/shared/rules/universal/UNI-099.md",
      "rule-id": "UNI-099"
    }
  ],
  "scan_profile": "consumer",
  "skills": [],
  "symlinks": [
    {
      "broken": false,
      "path": "link.md",
      "target": "doc.md"
    }
  ],
  "text_matches": [],
  "version": 1
}
